{
  "_doc": "Etiquetas de estilo individual (ADR 0024, fase1b-diseno.md §1.2). Una por jugador, sorteada al generarlo con la distribución de data/races/<id>.json.styleTagWeights. attributeBias se suma al de la raza al repartir el presupuesto de generación (Sim.Generation.PlayerGenerator): es lo que hace que, por ejemplo, un elfo Brute sea de verdad más fuerte que un elfo medio. name y description son texto a mano, no generado (docs/estilo-descripciones.md).",
  "Brute": {
    "name": { "es": "Bruto", "en": "Brute" },
    "description": { "es": "Busca el contacto. Gana duelos y reparte daño.", "en": "Seeks contact. Wins duels and deals out damage." },
    "attributeBias": { "strength": 5, "speed": -1, "technique": -3, "stamina": 2, "leash": -1 }
  },
  "Fine": {
    "name": { "es": "Fino", "en": "Fine" },
    "description": { "es": "Rehúye el choque y cuida el balón. Más preciso, menos físico.", "en": "Avoids the tackle and treasures the ball. More precise, less physical." },
    "attributeBias": { "strength": -4, "speed": 2, "technique": 4, "stamina": -2, "leash": 1 }
  },
  "Bulwark": {
    "name": { "es": "Muro", "en": "Bulwark" },
    "description": { "es": "Planta cara y no cede terreno. Sólido en el choque, corto de piernas.", "en": "Stands firm and holds ground. Solid in the tackle, short on legs." },
    "attributeBias": { "strength": 4, "speed": -1, "technique": -1, "stamina": 4, "leash": -2 }
  },
  "Cold": {
    "name": { "es": "Frío", "en": "Cold" },
    "description": { "es": "No se altera ni se cansa. Aguanta el partido entero sin perder la cabeza.", "en": "Never rattled, never tired. Lasts the whole match without losing his head." },
    "attributeBias": { "strength": -2, "speed": -3, "technique": 3, "stamina": 5, "leash": -3 }
  },
  "Neutral": {
    "name": { "es": "Neutro", "en": "Neutral" },
    "description": { "es": "Sin inclinación marcada. Ni bruto ni fino, un jugador de manual.", "en": "No strong leaning. Neither brute nor fine, a textbook player." },
    "attributeBias": { "strength": 0, "speed": 0, "technique": 0, "stamina": 0, "leash": 0 }
  }
}
